domain,name,source,icp_tier,icp_score,signal_score,signal_trust,signals,tags,batch,team_size,location,one_liner,description,company_url,source_url
cotool.ai,Cotool,yc_security,ICP 1,13,5,high,docs|app,cybersecurity|compliance|saas|security,p2025,3,"San Francisco, CA, USA",AI Agents for Security Operations Teams,"Cotool is an agentic security platform that eliminates manual and repetitive work for security teams.

Today’s cybersecurity teams remain bogged down by alert fatigue, context switching, and documentation overhead. Security teams don't need more dashboards with ""AI-powered insights"" — they need their time back.

Cotool empowers teams to build security their way. Our platform provides an AI co-pilot that automatically assembles context across tools, a no-code agent builder that transforms successful investigations into reusable automations, and automated report generation, providing comprehensive documentation in seconds.

Unlike solutions that force teams to adapt to vendor workflows, Cotool puts the power of AI directly in practitioners' hands, letting them shape tools around their unique processes. Early users have already cut time spent on investigation and detection engineering by 70%.",https://www.ycombinator.com/companies/cotool,https://www.ycombinator.com/companies/industry/security
overwatchdata.ai,Overwatch,yc_security,ICP 1,13,5,high,api|app,saas|supply-chain|ai|cybersecurity,s2022,5,"New York, NY, USA","Enterprise software for strategic, risk, and cyber fraud intelligence","Overwatch Data offers real-time, actionable intelligence tailored for your fraud, security, and strategic insights teams. Our platform provides a comprehensive and contextualized view of opportunities and risks, drawing on the surface, social, and deep web, thereby enabling faster, data-driven decision-making.",https://www.ycombinator.com/companies/overwatch,https://www.ycombinator.com/companies/industry/security
pally.com,Pally,yc_productivity,ICP 1,13,5,high,api|app,productivity|search|consumer|b2b|artificial-intelligence,s2025,3,"San Francisco, CA, USA",Intelligent Unified Inbox + Personal CRM,"We spend our lives in messaging apps. Slack. iMessage. WhatsApp. We face a constant stream of information, introductions, and things we need to do.

What if you could bring together every message, from every platform, in a Superhuman-like experience, with AI agents that automatically complete your action items?

That’s exactly what we’re building at Pally; a future where you never need to check another inbox again. ",https://www.ycombinator.com/companies/pally,https://www.ycombinator.com/companies/industry/productivity
sourcebot.dev,Sourcebot,yc_developer_tools,ICP 1,13,5,high,docs|app,open-source|b2b|devsecops|developer-tools|artificial-intelligence,f2025,2,"San Francisco, CA, USA",Helping humans and AI agents understand massive codebases,"Sourcebot is an open source code understanding platform for massive codebases. We’re used by thousands of engineers in some of the largest companies in the world, including NVIDIA, Red Hat, Wikimedia, and Arista Networks.

Understanding code, not writing it, is the primary bottleneck for large engineering teams. For developers, this means onboarding onto complex codebases faster. For AI agents, it means getting the necessary code context to minimize hallucinations and maximize cohesion within the wider codebase.

Sourcebot solves this by giving developers and AI agents the ability to regex search across millions of lines of code instantly, as well as ask questions across thousands of repos using any flagship reasoning model. Being open source and on-prem, we can get deployed in enterprises within minutes before other tools even get approval.

We met a decade ago at McGill University and have been building together full time for over 2 years. We’ve personally felt the pain of understanding large codebases while working at Microsoft, EA, Ubisoft, Google, and Meta.",https://www.ycombinator.com/companies/sourcebot,https://www.ycombinator.com/companies/industry/developer-tools
syntheticsciences.ai,Synthetic Sciences,yc_developer_tools,ICP 1,13,5,high,auth|app,reinforcement-learning|developer-tools|workflow-automation,w2026,2,,Synthetic Sciences is Claude Code for Science,"We’re building the infrastructure for a future AI co-scientist, starting with computational research domains. Our thesis is that capable AI scientists require two things built in tandem: (1) a human-centric product suite that generates high-quality process data, and (2) the research infrastructure to turn that data into increasingly autonomous systems. We’re creating the product and training infrastructure needed for research agents that can execute the full scientific loop.

Synthetic Sciences Web is our platform where scientists delegate complex research tasks to swarms of AI co-scientists across reading → hypotheses → methods → experimentation → results → drafting, even while they sleep. In parallel, we develop RL environments and process-based training data for LLMs, starting with agentic coding environments for ML research workflows.",https://www.ycombinator.com/companies/synthetic-sciences,https://www.ycombinator.com/companies/industry/developer-tools
10xscience.com,10x Science,yc_saas,ICP 1,13,4,high,api|status,biotech|enterprise-software|b2b|saas|ai,w2026,3,"San Francisco, CA, USA",The AI-native platform for next-generation protein characterization.,"Our mission at 10x Science is to enable biopharmaceutical development to keep pace with AI-powered drug discovery. 

Thanks to AI, the front end of drug discovery is flooding the pipeline with new drug candidates. However, current solutions for drug development are unable to resolve drug complexity and cannot keep up with modern demand. Our platform is the unlock for this bottleneck. 

By applying modern AI to the development stage, specifically to protein characterization and quality assessment, we provide an end-to-end solution to dramatically speed up and scale up the preparation of candidates for the clinic. 

Our team is composed of Stanford University researchers from a Nobel Laureate's lab with 18+ years of collective domain expertise, 47+ scientific publications, and a 2x YC Founder. We move at the highest velocity and are positioned to lead the next-generation of modern AI drug development. ",https://www.ycombinator.com/companies/10x-science,https://www.ycombinator.com/companies/industry/SaaS
alterai.dev,Alter,yc_security,ICP 1,13,4,high,docs|status,security|aiops|devsecops|developer-tools|artificial-intelligence,s2025,2,"New York, NY, USA",Secure access control and authorization platform for agent workflows,"Alter is a zero-trust identity and access control platform purpose-built for AI agents. It wraps every tool call in strong authentication, fine-grained authorization, and real-time guardrails, so agents can move fast without breaking things.

Each request is verified at the parameter level, authorized against granular policies, executed with least-privilege access, and fully audited in real time. Unsafe actions, whether it’s a rogue DROP TABLE or a payment above policy limits, are blocked before they touch production. Behind the scenes, Alter manages credentials, issuing ephemeral, scope-narrowed access for every interaction, then rotating or expiring it in seconds. The result: no long-lived secrets, no blind spots, and no surprises in audit.

With Alter, teams can move fast on AI agent initiatives while staying fully compliant with SOC 2, HIPAA, GDPR, and internal security standards. A CISO-ready dashboard delivers real-time visibility, detailed audit logs, and compliance-ready controls, removing silos, eliminating excessive permissions, and providing complete oversight of every agent workflow.",https://www.ycombinator.com/companies/alter,https://www.ycombinator.com/companies/industry/security
maywoodai.com,Maywood,yc_fintech,ICP 1,13,4,high,api|status,finance|fintech|b2b|artificial-intelligence,w2026,5,"New York, NY, USA",AI for M&A,"Maywood automates deal execution for investment banks, from decks to diligence

The Maywood platform automatically generates finished, on-brand CIMs / presentations, models, and diligence responses that prioritizes editability and auditability, with best-in-class security ensuring information stays protected.

Maywood reinvents the deal process with a single, living workspace for every deal.",https://www.ycombinator.com/companies/maywood,https://www.ycombinator.com/companies/industry/fintech
ashr.io,Ashr,yc_saas,ICP 1,13,3,high,api,developer-tools|data-engineering|devops|saas|artificial-intelligence,w2026,2,"San Francisco, CA, USA",Automated Multi-Modal Testing for Agents,"Ashr is a fully contained test and evals platform that improves AI agents by ensuring accuracy and quality across a wide range of user journeys through your product.

Ashr generates user journeys through your agents’ tool calls, results, and questions. We don’t generate one off tests, we generate large amounts of authentic user stories through your product, and pick up on errors, inconsistencies, and failures that would otherwise take hours of manual testing or get caught by a customer. We also work to ensure agent response quality in line with your business goals by offering custom evaluation metrics.

Ashr works with voice, text, automated website generation, image, file generation, and multimodal. We’re also willing to generate custom input types or make modifications for anyone interested. Currently, we integrate as an SDK, and are proactively working to make our documentation and resources as accessible and easy to use as possible.",https://www.ycombinator.com/companies/ashr,https://www.ycombinator.com/companies/industry/SaaS
cinder.co,Cinder,yc_security,ICP 1,13,3,high,docs,trust-&-safety|saas|b2b|compliance|ai,w2022,23,"New York, NY, USA","Cinder | Responsible AI, Trust & Safety, and Data Labeling At Scale","From content moderation to responsible AI, Cinder empowers businesses to orchestrate and automate digital safety at scale. Cinder was founded to help organizations foster safe online spaces for everyone. Our platform empowers companies from start-ups to enterprises with end-to-end capabilities to mitigate harm, investigate abuse, and produce trustworthy and reliable AI outcomes. Building your world-class company means keeping your users and community safe—Cinder unlocks faster growth by making safety easy. We work with customers in every industry from frontier AI labs to e-commerce and social media. 

We're hiring across a variety of teams and looking for candidates based in NYC or open to relocating to NYC, and able to work in-person.",https://www.ycombinator.com/companies/cinder-2,https://www.ycombinator.com/companies/industry/security
cofia.ai,Cofia,yc_saas,ICP 1,13,3,high,auth,saas|productivity|ai-assistant|artificial-intelligence,w2026,2,,AI automations that write themselves,"We learn how you work, and proactively create tailor-made automations you can deploy without you ever writing a prompt or relying on X for automation inspo.",https://www.ycombinator.com/companies/cofia,https://www.ycombinator.com/companies/industry/SaaS
crosslayerlabs.com,Crosslayer Labs,yc_saas,ICP 1,13,3,high,platform,saas|b2b|cybersecurity,w2026,3,"San Francisco, CA, USA","Protect, monitor and defend your Internet presence","Crosslayer Labs detects impersonation attacks on websites and APIs. We provide ""outside-in"" monitoring of customer infrastructure, comprehensively discovering and monitoring all Internet dependencies, including DNS, BGP, TLS certs, Javascript. We correlate signals from different layers of the Internet stack to identify attack patterns. Our alerts are actionable and contain root cause analysis/remediation recommendations. Our founding team is world renowned for previously inventing the MPIC standard adopted by all the major CAs including Google, Apple, Amazon. The MPIC standard is securing over 700 million websites via the issuance of over 3 billion digital certificates, and is now a global internet standard that protects every single HTTPS connection.",https://www.ycombinator.com/companies/crosslayer-labs,https://www.ycombinator.com/companies/industry/SaaS
paysponge.com,Sponge,yc_saas,ICP 1,13,3,high,api,payments|crypto-web3|fintech|artificial-intelligence|saas,w2026,3,,Financial infrastructure for the agent economy,"Sponge is the easiest way for agents to hold and spend money, and for businesses to sell directly to them.

For agents: Sponge lets agents hold funds and transact autonomously with other agents and businesses using bank accounts, cards, and crypto. Agents can autonomously purchase services such as email, browser use, and premium data without human involvement.

For businesses: Sponge makes it easy to onboard and accept payments from agents without human interaction. Businesses can sell their services directly to agents with a few clicks, no code changes required.",https://www.ycombinator.com/companies/sponge,https://www.ycombinator.com/companies/industry/SaaS
ralo.com,Ralo,yc_fintech,ICP 1,13,3,high,auth,consumer|fintech|artificial-intelligence,p2025,2,"San Francisco, CA, USA",Find Your Best Mortgage Deal,"Ralo is a mortgage platform built to deliver lower rates and lower fees by cutting out unnecessary intermediaries. We automate the complex work behind the scenes, from paperwork to pricing and negotiation.",https://www.ycombinator.com/companies/ralo,https://www.ycombinator.com/companies/industry/fintech
realitydefender.com,Reality Defender,yc_security,ICP 2,13,3,high,docs,security|privacy|deepfake-detection|saas|ai,w2022,54,"New York, NY, USA",Enterprise Deepfake Detection,"Reality Defender’s deepfake detection platform empowers enterprises to flag fraudulent users and content (audio calls, videos, images, documents). Our API and web app provides real-time risk scoring, reporting, alerts, and forensics review.  

Our team spent 20+ years at Google, Goldman Sachs, and the Intelligence Community at the intersection of data science and cybersecurity.
 
Customer Use Cases:

• Voice Voice Fraud (Ie. Realtime detection of AI generated voices for banks and call centers)

• Onboarding KYC (Ie. Anti-fraud to identify fraudulent users and materials)

• Content Moderation (Ie. Social media, e-commerce, marketplaces, dating, streaming)

• Disinformation Detection (Ie. News, defense, government)
 
Website: www.realitydefender.com

Contact: ask@realitydefender.com

YC AMA: https://news.ycombinator.com/item?id=30766050",https://www.ycombinator.com/companies/reality-defender,https://www.ycombinator.com/companies/industry/security
rhizomeai.com,Rhizome AI,yc_saas,ICP 1,13,3,high,docs,saas|biotech,w2026,1,"Jersey City, NJ, USA",Always know what the FDA thinks,"$8 trillion dollars of market cap needs to know what the FDA thinks. Rhizome AI makes that happen. 

Users ask a question and get an answer backed by up to 1,000 documents, where each statement has a citation. The data is pulled from terabytes of authoritative regulatory & clinical databases. 

Chetan started his career as a research engineer, but quickly realized he enjoyed building more than research. He joined EvolutionaryScale as their sole founding product engineer, launching their developer-scientist platform and scaling to tens of thousands of users and billions of API calls. He was also #16 at Instabase helping banks with document & imaging processing, closing $7m as the technical lead. 

Being so plugged into the AI world, he saw lots of AI drug discovery companies, but very few AI companies focused on bringing those drugs to market. Talking to people, it quickly became clear that a big, expensive barrier was understanding FDA thinking. ",https://www.ycombinator.com/companies/rhizome-ai,https://www.ycombinator.com/companies/industry/SaaS
runcanary.ai,Canary,yc_saas,ICP 1,13,3,high,api,b2b|saas|artificial-intelligence|developer-tools,w2026,4,"San Francisco, CA, USA",The first AI QA engineer that understands your codebase,"AI coding tools have made developers 100x faster but customer-facing incidents are up 43% YoY, QA hasn't kept up. Canary is the first AI QA engineer that understands your codebase. Instead of relying on flaky DOM scraping or screenshot analysis, Canary reads your source code directly to understand developer intent and catch broken user flows before they hit production. Engineering teams go from weeks of manual testing to 90%+ coverage in days. Built by a team that built coding agents at Windsurf, Cognition and Google.
",https://www.ycombinator.com/companies/canary,https://www.ycombinator.com/companies/industry/SaaS
trace.so,Trace,yc_productivity,ICP 1,13,3,high,api,productivity|b2b|saas|ai|enterprise-software,s2025,3,"San Francisco, CA, USA",Context-aware orchestration between humans and AI.,"Trace is a workflow orchestration platform that gives agents shared context across systems and lets teams build visual processes combining AI and humans. It automatically identifies which tasks can be AI-automated and which need human input, so non-technical teams build and run workflows without engineering involvement.",https://www.ycombinator.com/companies/trace-so,https://www.ycombinator.com/companies/industry/productivity
podium.com,Podium,yc_saas,ICP 3,12,18,high,api|docs|developer|auth|platform|app|status,ai|saas|b2b|fintech,w2016,1000,"Lehi, UT, USA",Get more leads. Make more money. ,"Podium is the all-in-one AI-powered lead management and communication platform used by more than 100,000 businesses to acquire and convert new customers. At the forefront of Podium’s innovation is its AI employee, who ensures businesses respond to leads instantly, anytime of the day or night—significantly increasing lead conversion rates and revenue.
Podium helps businesses obtain more reviews, rank higher on Google, and consolidate lead channels. Businesses can call and text customers from the web and/or mobile app, send payment links, drive repeat business through bulk messages, and more—all managed and delivered from one easy-to-use dashboard. Additionally, with Podium’s AI Employee and automations, businesses can efficiently handle customer inquiries seamlessly across all communication channels, providing timely and accurate responses that drive sales.
Podium’s innovative work has gained recognition on top industry lists, such as Forbes’ Next Billion Dollar Startups, Forbes’ Cloud 100, the Inc. 5000, and Fast Company’s World’s Most Innovative Companies.
Podium was founded in 2014 and is headquartered in Lehi, Utah. It is currently backed by Accel, Summit Partners, GV (formerly Google Ventures), and Y Combinator.",https://www.ycombinator.com/companies/podium,https://www.ycombinator.com/companies/industry/SaaS
amplitude.com,Amplitude,yc_b2b,ICP 3,12,15,high,api|docs|developers|auth|app|status,b2b|analytics|data-visualization|developer-tools|marketing,w2012,750,"San Francisco, CA, USA",Digital Analytics Platform,"Since graduating from YC, Amplitude (W12) has made it to IPO and beyond by helping cutting edge startups become category leaders. We’ve pioneered the digital analytics category to become the go-to solution for AI pioneers (Cruise, Midjourney), apps that touch millions of consumers (Doordash, Coinbase), and the best in B2B (Atlassian, Rippling, Canva).  

With product analytics, experiment, CDP, session replay, and more, Amplitude’s digital analytics platform shows you what your users love, where they’re getting stuck, and what keeps them coming back. You want to build a generational business, and we have the capabilities and pricing plans to guide you every step of the way. Check out our special deal for YC companies and get started on your analytics journey. ",https://www.ycombinator.com/companies/amplitude,https://www.ycombinator.com/companies/industry/b2b
checkr.com,Checkr,yc_b2b,ICP 3,12,15,high,api|docs|developer|developers|dashboard|status,compliance|enterprise-software|api|hr-tech|artificial-intelligence,s2014,800,"San Francisco, CA, USA",People infrastructure for the future of work,"Checkr builds people infrastructure for the future of work. And we believe everyone should have a fair chance to work. That's why we've designed a faster—and fairer—way to screen job seekers. For more information on our mission and products, visit https://checkr.com.",https://www.ycombinator.com/companies/checkr,https://www.ycombinator.com/companies/industry/b2b
brex.com,Brex,yc_fintech,ICP 3,12,14,high,api|developer|developers|app|dashboard|status,fintech,w2017,1000,"San Francisco, CA, USA","Business accounts, corporate cards, and spend management software.","Brex is the AI-powered spend platform for modern companies, from startups to enterprises. Combining corporate cards, expense management, travel, business accounts, and bill pay, Brex makes it easy to control spend before it happens with unprecedented efficiency and accuracy. Our mission is to empower employees anywhere to make better financial decisions, so we designed our platform to make expenses almost effortless with unrivaled automation of manual expense work and real-time tracking. Brex supports more countries and currencies than any other spend solution. Brex has tens of thousands of customers, including some of the most successful, high-growth companies, such as DoorDash, SeatGeek, Coinbase, ScaleAI, MasterClass, Indeed, Allbirds, and Superhuman.

Brex offers:
- Corporate cards with 10-20x higher limits
- Business accounts with easy wires, same-day liquidity, fast global payments, and $6M in FDIC insurance
- Reward options that include billboards, offsites, and coaching
- Founder-friendly financial modeling tools
- Special events and masterclasses for founders
- Advanced spend management software as startups grow that includes global capabilities, travel, bill pay and more.

",https://www.ycombinator.com/companies/brex,https://www.ycombinator.com/companies/industry/fintech
zapier.com,Zapier,yc_saas,ICP 3,12,13,high,api|docs|developer|platform|status,saas|b2b|automation,s2012,700,"Mountain View, CA, USA",The easiest way to automate your work.,"Founded in 2011, Zapier is the #1 workflow automation platform for small and mid-sized businesses. By connecting more than 6,000 of the most popular work apps, Zapier empowers its users to make the most of the tools they already use—and to focus on what matters most.",https://www.ycombinator.com/companies/zapier,https://www.ycombinator.com/companies/industry/SaaS
bird.com,Bird,yc_b2b,ICP 3,12,9,high,api|docs|app|status,messaging|api,s2016,500,"Amsterdam, Netherlands",The world’s largest omnichannel communications platform,"The world’s largest omnichannel communications platform.
 
Bird CRM powers communication between businesses and their customers — across any channel, always with the right context, and on every corner of the planet. Its products and solutions are the foundational building blocks to business communications across preferred channels, like SMS, Voice, WhatsApp, WeChat, Messenger, Email and more. Founded in 2011, Bird connects to billions of devices and is trusted by nearly 20,000 customers worldwide.
 
Headquartered in Amsterdam, Bird operates across nine global hubs — including Singapore, Dublin, Shanghai, Sydney, London, Bogota and Asuncion — and is proud to be a “Work Anywhere” company. Its team of 500 employees represent more than 55 nationalities.",https://www.ycombinator.com/companies/bird,https://www.ycombinator.com/companies/industry/b2b
gusto.com,Gusto,yc_b2b,ICP 3,12,9,high,api|docs|app|status,b2b|payroll|health-insurance,w2012,2400,"San Francisco, CA, USA",Provides growing businesses with everything to take care of their team,"Launched in 2012 as ZenPayroll, Gusto serves more than 300,000 businesses nationwide. Each year we process tens of billions of dollars of payroll and provide employee benefits—like health insurance and 401(k) accounts—while helping companies create incredible work places.

Through one refreshingly easy, integrated platform, we automate and simplify your payroll, benefits, and HR, all while providing expert support. You and your employees will get the peace of mind you need to do your best work.",https://www.ycombinator.com/companies/gusto,https://www.ycombinator.com/companies/industry/b2b
