domain,name,source,icp_tier,icp_score,signal_score,signal_trust,signals,tags,batch,team_size,location,one_liner,description,company_url,source_url
tinfoil.sh,Tinfoil,yc_security,ICP 1,13,15,high,api|docs|auth|console|dashboard|status,b2b|cybersecurity|privacy|artificial-intelligence|security,p2025,4,"San Francisco, CA, USA","Tinfoil makes your AI workflows secure, verifiable, and private.","Tinfoil makes it easy to make your AI workloads provably private, without changing your code. You get the privacy of on-prem deployments, while running on the cloud.

We’ve built a full-stack platform on top of the latest NVIDIA GPUs offering confidential computing capabilities, meaning that you don’t have to tradeoff performance for privacy. 

Under the hood, we integrate a suite of recent advances in secure hardware technologies, in particular NVIDIA’s confidential compute mode available on Hopper and Blackwell. When combined with Tinfoil’s software stack, companies can prove their security claims rather than relying on unenforceable statements like ""trust us, we don’t log your queries.” Tinfoil guarantees that all data always stays private and cannot be accessed by anyone other than the end user — not even by Tinfoil or the cloud provider it’s processed on. 

The founding team combines deep academic and industry experience in security and internet protocols. Tanya was previously a systems engineer at Cloudflare, where she built Internet security protocols used by billions, and contributed to the Workers AI platform. Jules and Sacha recently completed their PhDs at MIT where they worked on secure hardware and privacy-preserving technologies. Jules has also worked at NVIDIA on their confidential computing team. Nate has deep infrastructure experience, starting in high school when he built a mini-CDN that got him an internship at Cloudflare. Tinfoil was born from our personal frustration with the false choice between access to powerful AI and data privacy.

As AI becomes tightly integrated into our lives and business workflows, it will touch an ever increasing amount of sensitive personal and proprietary data. Right now, the only solutions are DPAs, band-aids like PII redaction, or the nuclear option of running everything on-prem. These solutions are not scalable.  By making it easy to deploy provable privacy, Tinfoil promises to unlock significantly deeper AI adoption and integrations, just as TLS on the Internet enabled e-commerce to flourish by securing credit cards on the network.

If OpenAI is creating “God in a box”, we are putting God in a blackbox, so Satan can’t spy.",https://www.ycombinator.com/companies/tinfoil,https://www.ycombinator.com/companies/industry/security
specific.dev,Specific,yc_developer_tools,ICP 1,13,13,high,api|docs|auth|app|dashboard,ai|developer-tools|no-code|devops,f2025,2,"Stockholm, Sweden",AWS for coding agents,Specific lets your coding agent write code and build the infrastructure to deploy it. Connect your favorite coding agent and start building immediately. Run `specific dev` to get a full local environment running in seconds. Run `specific deploy` to go to production on our scalable cloud platform in minutes.,https://www.ycombinator.com/companies/specific,https://www.ycombinator.com/companies/industry/developer-tools
oneleet.com,Oneleet,yc_security,ICP 2,13,12,high,api|docs|auth|app|status,b2b|compliance|security|saas|artificial-intelligence,s2022,50,,"YC's most popular security compliance platform (SOC 2, ISO 27001,…","Oneleet helps companies become secure and compliant through an all-in-one solution that combines automated tools and human expertise.

Oneleet has built the second generation of security compliance automation software, providing tools that go beyond what is classically provided for just compliance alone. Tools like a code security scanner, attack-surface management, access reviews and trust portal are all built in.

As the most popular, highest rated and most frequently used platform in the YC community, Oneleet has quickly established itself as the preferred and superior alternative to other incumbents.

The founder behind Oneleet has spent the past 10+ years helping companies become more secure by performing penetration tests.",https://www.ycombinator.com/companies/oneleet,https://www.ycombinator.com/companies/industry/security
better-auth.com,Better Auth,yc_security,ICP 1,13,11,high,api|docs|auth|app,developer-tools|security|open-source,p2025,4,"San Francisco, CA, USA",The authentication framework for TypeScript,"Better Auth is a comprehensive authentication framework for TypeScript that lets you implement everything from simple auth flows to enterprise-grade systems directly on your own database, embedded in your backend. It’s loved by developers all over the world and endorsed by leading voices in the ecosystem.

On top of the framework, Better Auth also provides an infrastructure layer to help you scale with user management and analytics, bot and fraud detection, transactional email and SMS, global session storage and more.",https://www.ycombinator.com/companies/better-auth,https://www.ycombinator.com/companies/industry/security
qfex.com,QFEX,yc_fintech,ICP 1,13,10,high,api|docs|auth|status,marketplace|fintech|trading,p2025,10,"London, UK",24/7 Global Stock Exchange,"QFEX is the 24/7 exchange for traditional financial markets.

We let you trade US equities, commodities and FX pairs with (or without) leverages of up to 100x. On QFEX, UX comes first: brokerless market access, seamless integration with traditional payment rails, and ultra-efficient Perpetual Futures offered over all asset classes. Trading has never been simpler, cheaper or fairer than with QFEX.

Founded by Quants and Engineers from Citadel & Tower Research who saw an opportunity to make markets how they always should have been, QFEX will eventually replace the entire $100 billion exchange and clearing industry.",https://www.ycombinator.com/companies/qfex,https://www.ycombinator.com/companies/industry/fintech
usedari.com,Dari,yc_developer_tools,ICP 1,13,10,high,api|docs|app|dashboard,robotic-process-automation|b2b|workflow-automation|developer-tools,f2025,2,"San Francisco, CA, USA",An API to build the most reliable browser use agents,"A platform where users can automate web workflows using natural language prompts.

We handle deterministic playback of browser workflows and fall back to LLMs where necessary, ensuring reliability. ",https://www.ycombinator.com/companies/dari,https://www.ycombinator.com/companies/industry/developer-tools
endclose.com,End Close,yc_saas,ICP 1,13,9,high,api|auth|app|status,payments|b2b|saas|fintech|ai,w2026,2,"San Francisco, CA, USA",AI powered reconciliation for high-volume payments companies,"End Close builds automatic reconciliation for payments companies like fintechs, marketplaces, banks and payroll companies. Reconciliation helps companies track every dollar and resolve every exception, ensuring they have no money loss, can report audit ready financials, and stay compliant.

Sean (CEO) spent the last 6 years building the reconciliation org at Modern Treasury (S18), processing a trillion dollars in payments across 40 banks with 99.995% automation. Fast growing companies like Modern Treasury are forced to build a solution in-house or buy a legacy solution. End Close provides a modern reconciliation system that works with a company's existing stack and is managed by AI agents.

Exception handling is where 99% of the manual work happens today, payment ops teams spend hours gathering context across various data sources to investigate each ticket. End Close provides an AI ops agent that connects to a company's data warehouse, invoicing platform and payment processors to triage and resolve issues without human intervention.

Legacy providers only provide reconciliation for month end close applications. End Close continuously reconciles with developer friendly APIs, allowing teams to integrate real time payments data within their products to create product experiences for customers like faster balance top-ups, instant trading etc. 

New payment rails and agent-to-agent payments are increasing online transaction volumes, making reconciliation a growing challenge for companies. David (CTO and 2nd time YC founder) most recently built these kinds of high-scale ingestion pipelines when starting and leading error tracking at PostHog (W20), the fastest growing product in the company's history.",https://www.ycombinator.com/companies/end-close,https://www.ycombinator.com/companies/industry/SaaS
hyperspell.com,Hyperspell,yc_developer_tools,ICP 1,13,9,high,api|docs|app|status,machine-learning|b2b|infrastructure|developer-tools|artificial-intelligence,f2025,3,"San Francisco, CA, USA",Memory for AI Agents,"Hyperspell (YC F25) gives AI agents memory.

It connects to tools like Slack, Gmail, Notion, and Drive so agents can recall, reason, and remember across company knowledge. Developers use Hyperspell’s API to turn disconnected agents into AI coworkers that understand their work. Conor and Manu founded Hyperspell after building their own workplace agent and seeing how limited AI is without memory. They have over 15 years of experience in machine learning and have scaled API-based products to $30M ARR.",https://www.ycombinator.com/companies/hyperspell,https://www.ycombinator.com/companies/industry/developer-tools
usechamber.io,Chamber,yc_developer_tools,ICP 1,13,9,high,api|docs|app|status,ai|artificial-intelligence|b2b|enterprise-software|developer-tools,w2026,4,"San Francisco, CA, USA",Autopiloting your AI infrastructure,"Chamber puts your AI infrastructure on autopilot. Our agentic AI enabled platform orchestrates, governs, and optimizes your AI infrastructure so teams can run ~50% more workloads on the same GPUs without manual intervention. It operates like an autonomous infrastructure team: continuously monitoring GPU clusters, forecasting demand, detecting unhealthy nodes, and reallocating resources in real time to where they create the most impact. Your ML teams move faster, infra waste drops, and GPU bottlenecks disappear.",https://www.ycombinator.com/companies/chamber,https://www.ycombinator.com/companies/industry/developer-tools
byteport.io,Byteport,yc_saas,ICP 1,13,8,high,docs|auth|dashboard,b2b|saas|infrastructure,w2026,1,"San Francisco, CA, USA",Global upload acceleration for 1GB-100TB files.,"Founded in 2025, Byteport is a technology company that builds mission-critical network infrastructure for robotics, satellite, AI, and enterprise applications all over the world. Businesses of every size—from new startups to public companies—use our software to accelerate file transfer online.",https://www.ycombinator.com/companies/byteport,https://www.ycombinator.com/companies/industry/SaaS
corelayer.com,Corelayer,yc_developer_tools,ICP 1,13,8,high,api|docs|app,enterprise-software|ai|artificial-intelligence|b2b|developer-tools,w2026,2,"San Francisco, CA, USA",AI on-call engineer that debugs using data,"We’re building AI agents that do on-call support for data-heavy industries like financial services and fintech, healthcare, and insurance.

On-call engineers in these industries need to inspect data to debug production issues. We monitor both data and infrastructure for issues and use AI agents to debug and suggest fixes in minutes.

Data is especially sensitive in regulated industries, so we offer on-prem deployments and hardware-backed secure environments that let agents safely use production data as context while debugging.

Mitch and Shipra founded Corelayer after building data infrastructure together at Goldman Sachs, where they spent many late nights and weekends debugging systems that processed 100s of billions of rows a day.",https://www.ycombinator.com/companies/corelayer,https://www.ycombinator.com/companies/industry/developer-tools
terminaluse.com,Terminal Use,yc_developer_tools,ICP 1,13,8,high,api|docs|app,infrastructure|developer-tools|aiops|workflow-automation|ai,w2026,4,"San Francisco, CA, USA",Vercel for background agents,"Terminal Use is an orchestration platform for background agents. Purpose-built for agents that use filesystems. Our platform is CLI-first, making it easy for your coding agents to experiment and continuously improve your deployed agents.",https://www.ycombinator.com/companies/terminal-use,https://www.ycombinator.com/companies/industry/developer-tools
unifold.io,Unifold,yc_fintech,ICP 1,13,8,high,api|docs|dashboard,crypto-web3|cryptocurrency|fintech|payments,w2026,3,"New York, NY, USA",Multi-chain deposit and payment infrastructure,"Launch crypto deposits in minutes. 

Unifold is a developer-first API + SDK that makes it easy for any app to accept on-chain deposits – across any chain and token – with less than 10 lines of code. We handle the full deposit flow so teams can ship faster and give users a smooth experience that actually works.

If you’re building a consumer-facing on-chain product and want best-in-class deposits (or want to support more chains fast), we’d love to work with you.
",https://www.ycombinator.com/companies/unifold,https://www.ycombinator.com/companies/industry/fintech
argalabs.com,Arga Labs,yc_saas,ICP 1,13,7,high,api|app|dashboard,developer-tools|aiops|saas,p2026,3,"San Francisco, CA, USA",The validation framework for AI agents,"Arga validates code changes & agents like a real engineer, because you were never meant to be QA for AI.

Connect your context tools (Slack, Linear, Sentry, etc.) and our agents turn every PR into multiple step-by-step user stories, clicking through your product with real context from your systems.

Every PR is deployed into our production-like sandbox and it runs against fully-functional mocks of external services, fully compatible with any API/SDK. These replicas surface edge cases traditional test suites miss, and you never hit rate limits. For AI agents, Arga automatically red-teams them: testing tool calls, behaviours, and failure modes before anything reaches production. ",https://www.ycombinator.com/companies/arga-labs,https://www.ycombinator.com/companies/industry/SaaS
dedaluslabs.ai,Dedalus Labs,yc_developer_tools,ICP 1,13,7,high,api|docs|status,ai|developer-tools|devops|workflow-automation,s2025,10,"San Francisco, CA, USA",Connect any model(s) to any tool(s) and ship hosted agents in minutes.,"1. Multi-model Agents SDK: build production-grade tool-calling agents in 5 lines of code using our open-source, vendor-agnostic SDK. Connect multiple models across providers (eg. Opus 4.6 + Gemini 3 Flash + GPT 5.4) within the same agent to optimize your agentic workflow's cost, latency, efficiency, and performance.

2. Agents-as-a-Service (AaaS): serve your agent or service as a hosted endpoint that anyone - including OpenClaw and Claude Code - can call.",https://www.ycombinator.com/companies/dedalus-labs,https://www.ycombinator.com/companies/industry/developer-tools
didit.me,Didit,yc_saas,ICP 1,13,7,high,api|docs|status,artificial-intelligence|saas|identity,w2026,12,"San Francisco, CA, USA",All-in-one identity platform for fast human verification.,"Didit is an all-in-one identity platform that lets humans prove who they are starting with a face scan. It powers the fastest identity verification in the market, fights fraud by default, and unifies all identity checks with simple pay-per-use pricing.",https://www.ycombinator.com/companies/didit,https://www.ycombinator.com/companies/industry/SaaS
usekestrel.ai,Kestrel AI,yc_security,ICP 1,13,7,high,docs|platform|status,infrastructure|kubernetes|security|aiops|cloud-computing,f2025,2,"San Francisco, CA, USA",AI-Native Cloud Incident Response Platform,"Kestrel is an AI-native cloud incident response platform that brings self-healing to cloud infrastructure. It monitors cloud and kubernetes infrastructure 24/7, finds root causes, and generates exact fixes - so incidents get resolved in seconds instead of hours.",https://www.ycombinator.com/companies/kestrel-ai,https://www.ycombinator.com/companies/industry/security
zeropath.com,ZeroPath,yc_security,ICP 1,13,7,high,docs|auth|status,cybersecurity|security|b2b|developer-tools|artificial-intelligence,s2024,4,"San Francisco, CA, USA",Automatically find and fix your software vulnerabilities,"ZeroPath is a developer tool that autonomously detects, verifies, and submits fixes for vulnerabilities in your code. Engineers can use ZeroPath to find security problems that they might only otherwise catch in pentests or from bug bounty researchers.",https://www.ycombinator.com/companies/zeropath,https://www.ycombinator.com/companies/industry/security
compresr.ai,Compresr,yc_developer_tools,ICP 1,13,6,high,api|auth,artificial-intelligence|developer-tools|b2b|enterprise-software,w2026,4,"San Francisco, CA, USA",LLM-native context compression ,Compresr provides an API that compresses LLM context without losing what matters. It’s a drop-in for agents and RAG that cuts token costs and improves accuracy.,https://www.ycombinator.com/companies/compresr,https://www.ycombinator.com/companies/industry/developer-tools
getadri.ai,Adri AI,yc_security,ICP 1,13,6,high,api|docs,compliance|security|sales|artificial-intelligence,w2023,2,"San Francisco, CA, USA",Vanta for AI,"Adri is built for enterprises that are buying AI. 

Our patented software monitors the AI vendor's infrastructure and detects any intentional or accidental misuse of your proprietary data.

We help you buy AI that you can trust. ",https://www.ycombinator.com/companies/adri-ai,https://www.ycombinator.com/companies/industry/security
runanywhere.ai,RunAnywhere,yc_developer_tools,ICP 1,13,6,high,docs|auth,ai|developer-tools|open-source|iot|hard-tech,w2026,2,,The production-grade infrastructure for running AI on every device,"Edge AI is inevitable, but shipping it is painful: every device class behaves differently, runtimes vary, models are huge, and performance collapses under memory/power constraints. RunAnywhere turns that into an enterprise-ready workflow: one SDK to run models on-device, plus a control plane to manage models, enforce policies, and measure outcomes across thousands of devices.",https://www.ycombinator.com/companies/runanywhere,https://www.ycombinator.com/companies/industry/developer-tools
sentrial.com,Sentrial,yc_developer_tools,ICP 1,13,6,high,api|auth,b2b|aiops|developer-tools|artificial-intelligence,w2026,2,"San Francisco, CA, USA",Production Monitoring for AI Agents,"Sentrial is the monitoring platform for AI products in production. 

When your AI product/agent loops indefinitely, hallucinates, or frustrates users, Sentrial detects it in real-time, diagnoses the root cause, and recommends specific fixes. We provide the monitoring, evaluation, and debugging infrastructure that traditional tools weren't built for, so teams iterate based on production reality, not just offline evals.",https://www.ycombinator.com/companies/sentrial,https://www.ycombinator.com/companies/industry/developer-tools
sequencemkts.com,Sequence Markets,yc_fintech,ICP 1,13,6,high,api|docs,ai|payments|fintech|crypto-web3,w2026,5,"New York, NY, USA",Low latency infrastructure for fragmented crypto markets,"Sequence Markets helps crypto traders save millions in hidden slippage by sourcing liquidity across CEX and DEX venues in one workflow.

Digital asset liquidity is fragmented across hundreds of venues. Teams are forced into manual venue-by-venue workflows, stitching order books in spreadsheets, with zero visibility into execution quality. The result? Inconsistent fills and millions in hidden slippage.

We built ultra-low-latency execution infrastructure (colocated servers, hardware accelerated networking, compiled code speed) with sub 12 microsecond internal latency (faster than NYSE). Our stack enables strategies that weren't possible before.

Save millions by eliminating hidden slippage. Make billions by trading faster and smarter",https://www.ycombinator.com/companies/sequence-markets,https://www.ycombinator.com/companies/industry/fintech
shortkit.dev,shortkit,yc_developer_tools,ICP 1,13,6,high,api|docs,infrastructure|developer-tools|video,w2026,2,,Short-form video SDK for consumer apps,"ShortKit lets any consumer app launch a TikTok-grade short-form video feed. We launched two weeks ago and have $4,450 MRR across 5 consumer apps. Our CTO, Michael, previously built and scaled the video infra behind YouTube Shorts, powering billions of hours of daily playback. Our CEO, Neil, prev. scaled a SaaS company from 0 to $6M ARR as employee #1. We handle the full short-form stack— client SDKs, video infrastructure, rec systems, and content marketplaces — so product teams don't have to.",https://www.ycombinator.com/companies/shortkit,https://www.ycombinator.com/companies/industry/developer-tools
usemoss.dev,Moss,yc_saas,ICP 1,13,6,high,api|docs,ai|developer-tools|saas,f2025,3,"San Mateo, CA, USA",Real-time semantic search for Conversational AI,"Moss is building the real-time semantic search runtime for conversational and multimodal AI. Our system enables voice agents, copilots, and chat interfaces to retrieve, reason, and respond in sub-10 ms, delivering the responsiveness that makes AI interactions feel truly natural.

If you’ve ever built a conversational or voice AI product, you’ve felt the lag. That moment when an agent pauses and the illusion of intelligence breaks. The bottleneck is almost always retrieval. Each query hops across networks and databases, adding delay and cost. Moss eliminates that gap by keeping retrieval close to where the agent runs.

Moss runs natively across browsers, mobile devices, and servers with an optimized vector index built in Rust and WebAssembly. It enables teams to build AI products that feel instant, contextual, and adaptive. The experiences that sustain engagement and unlock new kinds of interaction. For our customers, this translates into tangible business value: stronger user retention, higher conversion, and entirely new product categories made possible by real-time understanding. Moss is already powering production pilots across voice AI and developer platforms, achieving sub-10 ms retrieval and 70–90% token savings compared to traditional pipelines.",https://www.ycombinator.com/companies/moss,https://www.ycombinator.com/companies/industry/SaaS
veritus.com,Veritus,yc_fintech,ICP 1,13,6,high,docs|app|status,fintech|lending|ai,s2025,10,"San Francisco, CA, USA",AI agents for the consumer lending industry,"Veritus is a omni-channel platform for deploying AI agents for loan servicing and collections, including inbound and outbound voice agents. Our agents negotiate repayment plans, follow up across channels, and drive recoveries with zero human involvement.

By combining cutting edge voice AI with deep regulatory compliance and vertical specialization we're able to drastically reduce the cost-to-collect while increasing recovery rates. ",https://www.ycombinator.com/companies/veritus,https://www.ycombinator.com/companies/industry/fintech
agenticfabriq.com,Agentic Fabriq,yc_saas,ICP 1,13,5,high,auth|dashboard,aiops|saas|devsecops|api|infrastructure,w2026,2,"Sunnyvale, CA, USA",Okta for Agents.,"Agentic Fabriq is the single control plane for data permissioning throughout your entire organization across your AI and employees. Through Fabriq, any employee can tap into AI/agents with exactly the data and tools they're cleared to use by an admin. Fabriq can be used internally with employees or externally for customers while handling the auth + integrations + permissions securely for you.",https://www.ycombinator.com/companies/agentic-fabriq,https://www.ycombinator.com/companies/industry/SaaS
arzana.ai,Arzana,yc_saas,ICP 1,13,5,high,platform|app,industrial|productivity|saas,p2026,4,"San Francisco, CA, USA",AI automation for the manufacturing office,"Fortune 500 companies and the fastest-growing manufacturing firms use Arzana’s AI platform to automate order entry, quoting, and customer updates. So teams can scale faster, respond sooner, and grow without adding overhead.",https://www.ycombinator.com/companies/arzana,https://www.ycombinator.com/companies/industry/SaaS
arzule.com,Arzule,yc_saas,ICP 1,13,5,high,docs|app,ai|market-research|saas|b2b|machine-learning,w2026,2,"San Francisco, CA, USA",ROI attribution to scale ecosystem driven growth,"Arzule is an AI-native ecosystem revenue platform for B2B SaaS teams, starting with partnerships.

Arzule uses a quantitative approach to estimate ecosystem revenue impact by combining CRM deal outcomes with ecosystem signals such as shared customers, integrations, partner referrals, and co-selling activity. Using probabilistic regression models and influence chains across the ecosystem graph, Arzule estimates how much each partner or integration increases the likelihood of pipeline creation and deal conversion. This allows teams to prioritize the partnerships most likely to generate measurable revenue.

Beyond attribution, Arzule structures and manages the entire partnership lifecycle from identifying the right partners, to prioritizing based on revenue potential, to activating and scaling those relationships.

Using always-on AI agents and proprietary data, Arzule builds dynamic profiles of companies and predicts which opportunities will drive measurable revenue, when to engage, and how to structure each relationship for maximum impact.

It also optimizes execution through automated outreach, partner coordination, and performance tracking, ensuring every partnership and ecosystem motion is tied to clear ROI.",https://www.ycombinator.com/companies/arzule,https://www.ycombinator.com/companies/industry/SaaS
