domain,name,source,icp_tier,icp_score,signal_score,signal_trust,signals,tags,batch,team_size,location,one_liner,description,company_url,source_url
blocktorch.xyz,Blocktorch,speedinvest,ICP 2,7,5,high,docs|app,Exits,2023,,Germany,"End-to-end observability platform for logs, metrics, and traces for decentralized applications.","Blocktorch (acquired by third web in 2024) is the observability platform for the decentralized stack, covering all observability pillars to empower web3 developers to scale every decentralized component globally and serve billions of users reliably. We help builders to understand the behaviour of a decentralised application holistically, act quickly and become data driven. By enabling best in class observability practices, blocktorch is on the mission to make web3 mass-market ready.",https://www.blocktorch.xyz/,https://www.speedinvest.com/portfolio/
consola.finance,consola.finance,speedinvest,ICP 2,7,5,high,api|app,Exits,2022,,Austria,The first end-to-end finance and accounting collaboration platform for web3 firms.,"consola.finance (acquired by Request Finance in 2024) is on a mission to bring clarity and control to companies’ crypto finances with the first human-readable block(chain) explorer with dedicated finance, accounting, bookkeeping and reporting tooling. consola.finance automates crypto finance processes, saves valuable time, reduces human errors and gives companies the opportunity to make better decisions.",https://consola.finance/,https://www.speedinvest.com/portfolio/
finary.com,Finary,speedinvest,ICP 2,7,5,high,api|app,Fintech & DeFi,2021,,France,"Track all investments automatically and in real-time, regardless of the asset class.","Finary is a wealth management platform that provides users with an all-in-one, real-time dashboard of their investments across all asset classes. ‍ Finary counts 10,000 banks and investment platforms in Europe and the US connected to its system and covers saving accounts, stocks, crypto, real estate, precious metals, and startup investments overviews. Features such as real-time performance analysis, calculation of hidden costs and automatic identification of new opportunities allow Finary to offer tailor-made asset management that, previously, was only reserved for the wealthy.",https://finary.com,https://www.speedinvest.com/portfolio/
getoze.com,Ozé,speedinvest,ICP 2,7,5,high,api|app,"Middle East, Africa & Beyond",2021,,Ghana,Empowering African micro-SMEs to grow and scale.,"Despite merchants and micro-SMEs forming the pillars on which West African economies stand, these businesses have been overwhelmingly ignored and neglected by mobile-based financial service providers. Ozé helps capture, analyze and improve the performance of business owners in Ghana and Nigeria with the ambition to become a pan-African player. Through their digital accounting system, which enables users to keep track of their records, AR and AP and get access to credit, Ozé users are able to operate like large businesses and, therefore, empowers micro-SMEs to grow and scale far beyond their current reach. Having partnered with the region’s biggest banks, SME banks and local fintechs, Ozé is able to provide its users with products from traditional financial institutions but with the seamless interface and usability of a social media platform.",https://getoze.com/,https://www.speedinvest.com/portfolio/
getpliant.com,Pliant,speedinvest,ICP 2,7,5,high,api|app,Growth,2025,,Germany,A B2B payments platform built to meet the needs of high-growth businesses and embedded finance players.,"Pliant empowers businesses worldwide with streamlined B2B payment solutions. Designed to serve industries with complex, high-volume payment needs - like travel and ecommerce - Pliant's platform allows companies to issue cards, access credit lines, and payment features directly into their workflows. ‍ With seamless integrations, white-labeling options, and real-time APIs, Pliant enables full-stack control of business payments and reconciliation.",https://www.getpliant.com/,https://www.speedinvest.com/portfolio/
investly.co,Investly,speedinvest,ICP 2,7,5,high,api|app,Fintech & DeFi,2015,,Estonia,SME access to working capital through invoice financing.,"Investly is an invoice discounting platform that allows SMEs to sell their invoices to investors, thereby increasing working capital. Invoices are sold in reverse auctions where investors place bids to ensure the best prices for merchants. ‍ The bidding system allows investors to earn above average returns. Investly’s service helps established businesses take on more customers, speed up their production process, and avoid seasonal cash flow gaps.",https://www.investly.co/,https://www.speedinvest.com/portfolio/
kema.co,Kema,speedinvest,ICP 2,7,5,high,api|app,"Middle East, Africa & Beyond",2023,,United Arab Emirates,"A cash flow platform helping MENA SMEs get paid faster, automate A/R, and unlock invoice financing seamlessly.","Kema is revolutionizing how B2B SMEs in MENA manage their cash flow. By combining A/R automation, embedded payments, and invoice financing into one platform, the UAE-based startup empowers businesses to digitize collections, improve on-time payments, and unlock instant liquidity. With proprietary credit scoring built from ERP and payment data, Kema helps SMEs overcome late payments and limited financing access—long-standing barriers to growth in the region. ‍ ‍By embedding itself at the core of the invoice-to-cash cycle, Kema is bridging the gap between fintech and everyday business operations. Kema facilities more than $50M in annual receivables, improves collections by up to 40% and streamlines collection processed by more than 50%. As MENA moves toward further digitization and a cashless economy, Kema is uniquely positioned to become the financial operating system for the region’s $3T B2B economy.",https://www.kema.co/,https://www.speedinvest.com/portfolio/
kittl.com,Kittl,speedinvest,ICP 2,7,5,high,api|app,Growth,2021,,Germany,Empowering creators to create complex designs faster and easier.,"Kittl provides a platform that makes complex design processes easier and faster. ‍ The new browser-based graphic design tool empowers anyone to become a creator and design logos, labels, postcards or anything else. Loaded with tons of templates, illustrations, and fonts, it offers endless design possibilities.",https://www.kittl.com/,https://www.speedinvest.com/portfolio/
lemonflow.ai,Lemonflow,speedinvest,ICP 2,7,5,high,api|app,Climate Tech & Industrial Tech,2025,,Germany,The AI infrastructure layer for operations in mobility.,"Lemonflow builds voice-based AI agents that automate customer support across EV charging and mobility. Purpose-built for the complexities of mobility infrastructure, Lemonflow’s agents deliver instant, multilingual support around the clock, resolving driver issues, triggering remote actions, and drastically cutting costs. ‍ Live with leading charge point operators across Europe, Lemonflow combines deep domain expertise with real-time system integrations to create a scalable support layer for the future of mobility.",https://lemonflow.ai/,https://www.speedinvest.com/portfolio/
lizzy-ai.com,LizzyAI,speedinvest,ICP 2,7,5,high,api|app,Marketplaces & Consumer,2025,,United States of America,"Recruiting platform that uses AI-powered interviews to help companies hire faster, fairer, and more efficiently.","Founded in the USA by serial entrepreneur Yannis Niebelschütz, Lizzy AI is a next-generation recruiting platform that uses AI-powered, structured interviews to streamline and standardize hiring. The platform automatically generates interview questions, conducts assessments, and delivers clear, comparable scoring to reduce bias and accelerate decisions. Companies use Lizzy AI to evaluate candidates more objectively and at scale, while significantly reducing recruiter workload. The result: faster hiring, better talent matches, and an improved candidate experience.",https://www.lizzy-ai.com/,https://www.speedinvest.com/portfolio/
metycle.com,Metycle,project_a,ICP 2,7,5,high,platform|app,"",Seed,,Cologne,Secondary metals trading platform,,https://metycle.com/,https://www.project-a.vc/companies
pacerevenue.com,Pace Revenue,speedinvest,ICP 2,7,5,high,api|app,Exits,2016,,United Kingdom,Hospitality revenue management platform utilizing machine learning and statistical modelling.,"Pace (acquired by FlyrLabs in 2022) was founded to change revenue management and help companies be more effective in their distribution and sales - empowering them to make better use of resources, generate less waste, and contribute to a better world.",https://www.pacerevenue.com/,https://www.speedinvest.com/portfolio/
prewave.ai,Prewave,speedinvest,ICP 2,7,5,high,api|app,Growth,2018,,Austria,Predicting supply chain and sustainability risks.,"Prewave is an Austrian-based AI company that specializes in supply chain risk intelligence and monitoring for global enterprises. The platform continuously monitors and analyzes massive amounts of public and non-public data, including news, social media, and industry reports, to predict supply chain disruptions before they occur. ‍ The company transforms unstructured data into actionable, real-time alerts for risks like geopolitical events, factory fires, labor disputes, and sustainability violations anywhere in a company’s multi-tier supply network. ‍",https://www.prewave.ai/,https://www.speedinvest.com/portfolio/
rival.tech,RIVAL,speedinvest,ICP 2,7,5,high,auth|app,Marketplaces & Consumer,2025,,United Kingdom,Bringing user-generated content to AR/VR.,"Rival is building a platform that allows users to browse through immersive 3D short-form content in their spatial computing headset, in a similar fashion to how TikTok or Instagram Reels work with conventional videos. Enabling users to produce and distribute 3D experiences via their first-of-its-kind 2D-3D foundational model, Rival enables the creator economy to transition to VR, solving the industry's biggest problem - its lack of content. ‍",http://www.rival.tech,https://www.speedinvest.com/portfolio/
rivia.ch,Rivia,speedinvest,ICP 2,7,5,high,docs|app,Health & Bio,2024,,Switzerland,AI-driven analytics and data infrastructure for successful Biopharma clinical trials.,"Rivia addresses inefficiencies in biopharma clinical trials, where fragmented data and outdated tools hinder the development of new therapies. Their technology offers a real-time, integrated view of data to improve the evaluation of new treatments and trial conduct. Their vision is to become the unified data infrastructure that transforms clinical development lifecycles, bringing new therapies to market more successfully.",https://rivia.ch/,https://www.speedinvest.com/portfolio/
sona.is,Sona,speedinvest,ICP 2,7,5,high,api|app,Growth,2021,,United Kingdom,Workforce management built for frontline workers.,"Sona’s mission is to put technology in the hands of frontline staff that transforms how they manage their work and engage with their employer. Designed for the specific needs of modern frontline workplaces, Sona’s employee app combines powerful productivity tools with a sleek, simple and intuitive user experience. ‍ Features include live schedule view, absence management, instant messaging, and Open Shifts, an innovative shift booking platform matching shift vacancies with employees willing to take on more hours. Trailblazing organisations across health and social care, retail, and the third sector are revolutionising the way they manage, engage and retain their staff.",https://www.sona.is/,https://www.speedinvest.com/portfolio/
speechblubs.com,BlubBlub,speedinvest,ICP 2,7,5,high,api|app,Health & Bio,2017,,United States of America,Video modeling and gamified activities to help children improve their speech and language skills.,"Speech therapists still assign homework on sheets of paper, because the industry has not yet been digitized. BlubBlub decided to change this by introducing its video app, which triggers sounds and words recorded by children and for children, helping them to practice in their specific language to address their specific speech problem. ‍ BlubBlub connects children, therapists and parents on one platform to ensure everyone plays a role in each child's progress.",https://speechblubs.com/,https://www.speedinvest.com/portfolio/
taxscouts.com,TaxScouts,speedinvest,ICP 2,7,5,high,auth|app,Exits,2018,,United Kingdom,"Personal income tax autopilot enabling simplicity, automation, and speed.","TaxScouts (aquired by Taxfix in 2024) simplifies tax assessment and filing. ‍ The company has built the automation required to calculate, assess and reliably file personal income tax for non-standard incomes including professional freelancers, landlords, high earners and more.",https://taxscouts.com/,https://www.speedinvest.com/portfolio/
waypointcommodities.com,Waypoint,project_a,ICP 2,7,5,high,api|app,"",Seed,,London,The international platform for fertilisers & commodity chemicals,,https://www.waypointcommodities.com/,https://www.project-a.vc/companies
fiatrepublic.com,Fiat Republic,speedinvest,ICP 2,7,4,high,docs|status,Fintech & DeFi,2021,,United Kingdom,"A purpose-built, fiat-as-a-service platform to solve fiat access challenges for crypto platforms.","Fiat Republic is on a mission to democratize fiat access for the Web3 economy. Fiat access is a systemic problem for crypto platforms and therefore requires a systemic solution. With our developer-first API, you can easily access everything you need to deliver better fiat experiences to your users and treasury teams. We’re unlocking and aggregating an ever increasing number of fiat rails with local and global tier-1 banks. Fiat Republic is able to give crypto platforms reliable access to best-in-class fiat products, all via a single API. We have developed a compliance-first approach that minimises friction in the on-ramp and off-ramp fiat-crypto flows. Our technology is augmented by the Fiat Republic Consortium. We’re building a coalition of crypto platforms to create a united voice, enabling us to continually add tier-1 global and local banking partners and have a seat at the table with regulators, to shape and influence the future rules that govern the space.",https://fiatrepublic.com/,https://www.speedinvest.com/portfolio/
juli.co,Juli,speedinvest,ICP 2,7,4,high,api|status,Health & Bio,2022,,Switzerland,Improving life for people with chronic conditions.,"Juli integrates previously siloed data like data from smartphones and other wearables, environmental data and EHR data into one platform. All that data is analyzed to identify patterns and give recommendations that guide users towards better health. A patient-centric app allows the user to see their data in one dashboard, keep a journal, get reminders for their medication or be nudged towards micro-behavioural changes in a gamified way. ‍ juli is a SMART on FHIR platform that integrates easily into all kinds of health systems. This enables care providers to predict when a patient needs additional outreach to avoid a crisis and generates a common understanding of a patient's health status.",https://www.juli.co/team,https://www.speedinvest.com/portfolio/
quix.io,Quix,project_a,ICP 2,7,4,high,docs|status,"",Seed,,London,Data streaming analytics platform,,https://quix.io/,https://www.project-a.vc/companies
abhi.com.pk,Abhi,speedinvest,ICP 2,7,3,high,api,"Middle East, Africa & Beyond",2022,,Pakistan,Pakistan's first financial wellness platform focused on democratizing credit for both individuals and businesses.,"Founded in 2021, Abhi is building practical financial infrastructure for emerging markets. As a next-generation neobank, it provides Earned Wage Access and flexible SME financing that give workers and businesses quicker, more reliable access to liquidity. The model solves everyday cash-flow challenges and makes essential financial services easier to reach. Abhi also became the first MENAP-based startup to receive the World Economic Forum’s Technology Pioneer Award.",https://abhi.com.pk/,https://www.speedinvest.com/portfolio/
agro.club,Agro.Club,speedinvest,ICP 2,7,3,high,api,"Middle East, Africa & Beyond",2020,,United States of America,Two-sided agricultural marketplace with embedded financial services.,"Agro.Club is digitizing the global agricultural value chain by connecting input suppliers, grain buyers, and farmers through a comprehensive digital ecosystem, aiming for greater transparency and efficiency in supply management. ‍ The platform offers essential digital services like e-commerce, grain procurement, and business intelligence. It also provides embedded financial solutions, including factoring and credit, directly within transactions, helping stabilize cash flow, expand capital access for agricultural partners, and simplifies complex supply chain interactions.",https://agro.club/,https://www.speedinvest.com/portfolio/
andercore.com,Andercore,project_a,ICP 2,7,3,high,api,"",Pre-Seed,,Berlin,AI-powered industrial trade platform,,https://www.andercore.com/,https://www.project-a.vc/companies
appparadox.com,Paradox,speedinvest,ICP 2,7,3,high,api,AI & Infra,2025,,Denmark,Replacing fragmented tools with an AI-powered platform that unifies organizational intelligence and enables aligned decision-making.,"Paradox is building a new kind of organizational intelligence — one that addresses a simple but costly truth: most leaders have little real-time insight into what’s happening across their companies. ‍ Despite layers of tools, meetings, and reports, strategic clarity often breaks down as companies scale. Teams pull in different directions, decisions drift, and precious time is lost chasing alignment that never quite clicks. Ironically, the systems meant to bring order often add more complexity, not less. ‍ That’s the paradox being solved. Instead of stacking yet another tool on top, Paradox has developed an AI-powered reasoning layer that connects the dots across the business — surfacing hidden constraints, tracking strategic flow, and ensuring the right people get the right information at the right time.",https://appparadox.com/,https://www.speedinvest.com/portfolio/
bikemap.net,Bikemap,speedinvest,ICP 2,7,3,high,api,Marketplaces & Consumer,2016,,Austria,"Create, upload, and share your favorite cycle routes.","Bikemap is a platform where bike enthusiasts around the world create, upload and share their favorite cycle routes. The Bikemap app lets users record routes on the go, add their own photos or notes and share it all on social media. ‍ Bikemap has evolved to become the largest bike route collection in the world– with active users in more than 80 countries sharing their cycling experiences from all around the world. More than 1,500 new routes are created by Bikemap users on a every day; enriched with information such as route length and interactive elevation profile for every cycling route. To date, users have access to more than 3 million different routes.",https://www.bikemap.net/,https://www.speedinvest.com/portfolio/
bliq.ai,bliq,speedinvest,ICP 2,7,3,high,docs,Marketplaces & Consumer,2022,,Germany,Empowering gig workers in the transport industry to manage their workflow across multiple platforms.,"Berlin-based Bliq lets its users maximize their earnings while driving more safely, while creating a safer, fairer, more sustainable gig economy.",https://bliq.ai/,https://www.speedinvest.com/portfolio/
clausematch.com,ClauseMatch,speedinvest,ICP 2,7,3,high,developers,AI & Infra,2017,,United Kingdom,Real-time document editing and collaboration for highly regulated industries.,"Evolve with compliance. The award-winning ClauseMatch policy management, regulatory change management and compliance SaaS platform automates time-sucking tasks, organizes your data and makes collaboration and knowledge-sharing a breeze. ‍",http://www.clausematch.com/,https://www.speedinvest.com/portfolio/
djust.io,Djust,speedinvest,ICP 2,7,3,high,api,AI & Infra,2025,,France,Modular B2B commerce platform automating sales operations,"DJUST is a modular B2B commerce platform that enables companies to streamline their sales operations and increase productivity across the organization. With advanced payment capabilities and an Agentic Commerce approach, DJUST is redefining how businesses design, manage, and automate their commercial interactions. ‍ The platform empowers leading distributors, retailers, and manufacturers to break down system silos, digitise manual processes, and unlock new growth opportunities. More than a flexible order management system, DJUST is a foundational layer that helps future-proof businesses through scalability and continuous innovation. ‍ Backed by a global partner network, DJUST combines technological expertise with a human touch, supported by a team of 50+ B2B digital commerce experts across Europe.",https://www.djust.io/,https://www.speedinvest.com/portfolio/
eunice.ai,Eunice,speedinvest,ICP 2,7,3,high,api,Deep Tech,2022,,United Kingdom,Bridging data and action to empower the sustainable development of Web3 and Crypto.,"Eunice is an AI fintech company solving B2B challenges in digital assets. Their first product is digital asset due diligence and monitoring to help financial institutions, regulators, and businesses navigate the complexities of the digital asset space. Powered by a proprietary knowledge base, Eunice’s platform enables token classification, risk analysis, and asset disclosure requirements. ‍ With a mission to bring transparency to the digital asset industry, Eunice builds products that drive regulatory clarity and operational efficiency, intending to accelerate the mainstream adoption of digital assets.",https://www.eunice.ai/,https://www.speedinvest.com/portfolio/
exa.finance,EXA Finance,speedinvest,ICP 2,7,3,high,docs,AI & Infra,2022,,France,The most advanced marketplace for NFTs and fungible tokens on Algorand.,"Incubated by Draper University and backed by prominent VCs, EXA Finance is the most advanced marketplace for NFTs and fungible tokens on Algorand. ‍ The platform offers a multitude of features such as assets bundle, NFT to NFT swap, auctions, offers, royalties, and peer-to-peer chat just to name a few. Users can now sell NFTs for any fungible token but also swap an NFT for multiple NFTs, opening a new range of possibilities.",https://www.exa.finance/,https://www.speedinvest.com/portfolio/
getmundi.app,Mundi,speedinvest,ICP 2,7,3,high,api,Fintech & DeFi,2024,,Turkey,"Treasury-as-a-Service platform for companies without dedicated treasury teams to optimize funds in high-yield, low-risk financial products.","Mundi simplifies access to high-yield savings accounts by connecting users to 15+ Turkish banks through a single investment platform. With one-click access to overnight and long-term savings accounts for TRY and FX deposits, Mundi enables effortless, automated working capital management. Beyond savings accounts, users can dynamically allocate funds to low-risk financial products, including money market funds (MMFs) and overnight repo agreements, all within Mundi’s seamless investment platform. ‍",https://www.getmundi.app/,https://www.speedinvest.com/portfolio/
gronda.eu,gronda,speedinvest,ICP 2,7,3,high,api,Marketplaces & Consumer,2015,,Austria,Career platform for the hospitality and gastronomy sector.,"Gronda is an industry blog and community platform designed to facilitate recruitment, transparency and knowledge exchange in the hospitality and gastronomy industries. ‍ The platform helps industry professionals showcase their expertise as well as connecting and applying to open positions. For companies, this is a one-stop-shop platform to recruit talent, build their employer brand, and solve their industry’s persistent labor shortage.",https://gronda.eu/,https://www.speedinvest.com/portfolio/
invesdor.com,Invesdor,speedinvest,ICP 2,7,3,high,api,Fintech & DeFi,2014,,Finland,Digital investment and financing platform for companies of all sizes.,"Invesdor Group combines the leading digital equity funding platform in the Nordics, Invesdor, and the leading digital mid-size (“Mittelstand”) financier in the German speaking countries, Finnest. The service portfolio spans from equity investments, bonds, IPO’s, syndicated loans, mezzanine capital and promissory notes to other debt capital instruments. Financing volumes typically range from EUR 250,000 to EUR 25m. Over the last years the combined and accumulated investments on the legacy platforms have doubled every year, currently totalling at more than EUR 130m. ‍ Invesdor Group holds a MiFID license passported to 28 European countries, which was granted to Invesdor in April 2015, making it the first such platform to receive this licence. The Group has a base of over 50,000 registered private and institutional investors from 150 countries.",https://www.invesdor.com/en-gb/,https://www.speedinvest.com/portfolio/
iyzico.com,Iyzico,speedinvest,ICP 2,7,3,high,docs,"Middle East, Africa & Beyond",2013,,Turkey,Offering vendors a fast and easy way to receive payments online.,Iyzico (acquired by PayU in 2019) is Turkey’s leading ePayment company offering businesses easy solutions to accept payments online. ‍ The platform is tailored to the needs of the local market and integrates with over 22 different payment options and banks. Customers appreciate the easy setup process and features such as recurring payments and Iyzico’s marketplace solution.,http://www.iyzico.com/,https://www.speedinvest.com/portfolio/
