domain,name,source,icp_tier,icp_score,signal_score,signal_trust,signals,tags,batch,team_size,location,one_liner,description,company_url,source_url
gitlab.com,GitLab,yc_b2b,ICP 3,12,7,high,docs|developer|status,open-source|developer-tools|devsecops,w2015,2000,"San Francisco, CA, USA",A complete DevOps platform delivered as a single application.,"GitLab is the first single application for the entire DevOps lifecycle. Only GitLab enables Concurrent DevOps, unlocking organizations from the constraints of today’s toolchain. GitLab provides unmatched visibility, radical new levels of efficiency and comprehensive governance to significantly compress the time between planning a change and monitoring its effect. This makes the software lifecycle 200% faster, radically improving the speed of business.

GitLab and Concurrent DevOps collapses cycle times by driving higher efficiency across all stages of the software development lifecycle. For the first time, Product, Development, QA, Security, and Operations teams can work concurrently in a single application. There’s no need to integrate and synchronize tools, or waste time waiting for handoffs. Everyone contributes to a single conversation, instead of managing multiple threads across disparate tools. And only GitLab gives teams complete visibility across the lifecycle with a single, trusted source of data to simplify troubleshooting and drive accountability. All activity is governed by consistent controls, making security and compliance first-class citizens instead of an afterthought.

Built on Open Source, GitLab leverages the community contributions of thousands of developers and millions of users to continuously deliver new DevOps innovations. More than 100,000 organizations from startups to global enterprise organizations, including Ticketmaster, Jaguar Land Rover, NASDAQ, Dish Network and Comcast trust GitLab to deliver great software at new speeds.",https://www.ycombinator.com/companies/gitlab,https://www.ycombinator.com/companies/industry/b2b
wave.com,Wave,yc_fintech,ICP 3,12,7,high,api|docs|status,fintech,w2012,1600,"Dakar, Senegal",Mobile money app for Africa,Building extremely affordable financial infrastructure for Africa.,https://www.ycombinator.com/companies/wave,https://www.ycombinator.com/companies/industry/fintech
algolia.com,Algolia,yc_saas,ICP 3,12,6,high,docs|dashboard|status,developer-tools|saas|b2b,w2014,810,"San Francisco, CA, USA",A developer-friendly and enterprise-grade search API.,"Our mission is to make every search interaction meaningful & rewarding, through developer-friendly and enterprise-grade APIs.

Algolia is the leading Search & Discovery API for websites and mobile apps. We help the most innovative companies across e-commerce, media and SaaS industries create powerful, relevant and scalable discovery experiences for their users. Unlike other solutions, our hosted platform reduces the complexities of building and scaling a fast, relevant digital experience and helps teams accelerate development time. More than 9,000 companies like Under Armour, Twitch, Periscope, Medium and Stripe rely on Algolia to manage 50+ billion search queries a month.

Founded in 2012, we're backed by $184M in funding from Accel Partners, Alven Capital, Point Nine Capital and Storm Ventures. The team is headquartered in San Francisco with offices in Paris, London, New York, and Atlanta. To learn more, visit www.algolia.com.

---
We’re looking for talented, passionate people to build the world’s best search technology. As an ownership-driven company, we seek team members who thrive under autonomy and diversity. 

We're committed to building an inclusive and diverse workplace. We care about each other and the world around us, and embrace talented people regardless of their race, age, ancestry, religion, sex, gender identity, sexual orientation, marital status, color, veteran status, disability and socioeconomic background",https://www.ycombinator.com/companies/algolia,https://www.ycombinator.com/companies/industry/SaaS
getweave.com,Weave,yc_saas,ICP 3,12,6,high,auth|app|status,saas,w2014,600,"Lehi, UT, USA",Customer communication and payments platform.,"As the pace of innovation continues, it is growing more difficult to see the value of technology. Often meaningful information is inaccessible at the time it would be most beneficial. Weave threads together data, software and communication platforms to build stronger relationships at the point of contact by making valuable information instantly available in simple and intuitive formats. This delivers improved productivity, better collaboration and greater insights making it easier to meet the needs of patients and to build better business and clinical outcomes.",https://www.ycombinator.com/companies/weave,https://www.ycombinator.com/companies/industry/SaaS
yapily.com,Yapily,hv_capital,ICP 2,10,15,high,api|docs|auth|console|dashboard|status,fintech,seed,,"London, UK","Yapily is an award-winning, 'API Only' technology provider whose mission is to enable innovative products to connect to banks, empowering a new generation of financial services. It provides a seamless, secure and scalable pathway for end users to connect to their finances and make payments. Yapily works behind the scenes, providing API connectivity to all banks via a single integration to retrieve data and initiate payments.","Yapily is an award-winning, 'API Only' technology provider whose mission is to enable innovative products to connect to banks, empowering a new generation of financial services. It provides a seamless, secure and scalable pathway for end users to connect to their finances and make payments. Yapily works behind the scenes, providing API connectivity to all banks via a single integration to retrieve data and initiate payments.",https://www.yapily.com/,https://www.hvcapital.com/companies
omnea.co,Omnea,point_nine,ICP 2,10,12,high,api|docs|auth|app|status,Enterprise|Fintech|Vertical Software|AI,Pre-seed,,"London, UK","Omnea is an AI-native procurement and supplier relationship management platform that streamlines intake, approvals, and renewals, centralizes supplier data, and automates third‑party risk and performance workflows across systems.","Omnea is an AI-native procurement and supplier relationship management platform that streamlines intake, approvals, and renewals, centralizes supplier data, and automates third‑party risk and performance workflows across systems.",https://www.omnea.co/,https://www.pointnine.com/companies
revolut.com,Revolut,point_nine,ICP 2,10,11,high,api|developer|developers|app,Consumer|Fintech,Seed,,"London, UK","Revolut is the leading global neobank. Founded in London in 2015, Revolut has become a global financial super app, unifying everyday money management – spend, send, save, invest, and business finances – in a single platform.","Revolut is the leading global neobank. Founded in London in 2015, Revolut has become a global financial super app, unifying everyday money management – spend, send, save, invest, and business finances – in a single platform.",https://revolut.com/,https://www.pointnine.com/companies
rekordsoftware.com,rekord,point_nine,ICP 2,10,9,high,docs|auth|app|status,Enterprise|Fintech|AI|Vertical Software,Pre-seed,,"Dublin, Ireland","Rekord is an AI-native platform that enables financial institutions to design, scale, and monitor intelligent decision flows across underwriting, onboarding, compliance, and fraud. It unifies models, data, and policies to operationalize AI with guardrails and real-time observability.","Rekord is an AI-native platform that enables financial institutions to design, scale, and monitor intelligent decision flows across underwriting, onboarding, compliance, and fraud. It unifies models, data, and policies to operationalize AI with guardrails and real-time observability.",https://www.rekordsoftware.com/,https://www.pointnine.com/companies
rvvup.com,rvvup,hv_capital,ICP 2,10,9,high,api|docs|dashboard|status,fintech,seed,,"London, UK","Founded in London late 2020, Rvvup’s purpose is to enable the seamless interoperability of CeFi and DeFi with advanced infrastructure that empowers and future proofs businesses with embedded finance, payments as a service and enhanced digital money movement. In 2025 Rvvup was acquired by Zopa","Founded in London late 2020, Rvvup’s purpose is to enable the seamless interoperability of CeFi and DeFi with advanced infrastructure that empowers and future proofs businesses with embedded finance, payments as a service and enhanced digital money movement. In 2025 Rvvup was acquired by Zopa",https://www.rvvup.com/,https://www.hvcapital.com/companies
upvest.co,UPVEST,hv_capital,ICP 2,10,7,high,api|docs|status,fintech,early,,"Berlin, Germany","Upvest’s blockchain APIs enable businesses to offer seamless blockchain wallets, transactions, smart contracts and data to their end users (B2B2C model). Upvest empowers anyone to access major blockchains like Bitcoin and Ethereum instantly without prior knowledge. One of the first use cases is fintechs and blockchain apps where the Upvest wallet infrastructure can be integrated as a self-custody solution with recovery features for the end-users, thereby replacing an intermediary bank.","Upvest’s blockchain APIs enable businesses to offer seamless blockchain wallets, transactions, smart contracts and data to their end users (B2B2C model). Upvest empowers anyone to access major blockchains like Bitcoin and Ethereum instantly without prior knowledge. One of the first use cases is fintechs and blockchain apps where the Upvest wallet infrastructure can be integrated as a self-custody solution with recovery features for the end-users, thereby replacing an intermediary bank.",https://www.upvest.co/,https://www.hvcapital.com/companies
getbux.com,Bux,hv_capital,ICP 2,10,6,high,docs|auth,fintech,growth,,"Amsterdam, Netherlands","BUX is a fintech firm that makes investing in the financial markets accessible and affordable to everyone. Its simple onboarding and intuitive user interface make it the perfect platform for anyone wanting to get a taste of investing that is put off by the complexities and cash requirements of traditional brokers. BUX is offering zero commission investing in shares and ETFs, but also in cryptocurrencies and derivatives.","BUX is a fintech firm that makes investing in the financial markets accessible and affordable to everyone. Its simple onboarding and intuitive user interface make it the perfect platform for anyone wanting to get a taste of investing that is put off by the complexities and cash requirements of traditional brokers. BUX is offering zero commission investing in shares and ETFs, but also in cryptocurrencies and derivatives.",http://www.getbux.com/,https://www.hvcapital.com/companies
exporo.de,Exporo,hv_capital,ICP 2,10,5,high,auth|app,fintech,growth,,"Hamburg, Germany","Exporo is the leading German crowdfunding platform for real estate investments. Exporo enables retail investors to participate in attractive real estate investment opportunities with amounts as low as 500 Euro, while at the same time opening up a faster and cheaper source of funding for real estate developers.","Exporo is the leading German crowdfunding platform for real estate investments. Exporo enables retail investors to participate in attractive real estate investment opportunities with amounts as low as 500 Euro, while at the same time opening up a faster and cheaper source of funding for real estate developers.",https://www.exporo.de/,https://www.hvcapital.com/companies
boku.com,Boku,hv_capital,ICP 2,10,3,high,developer,fintech,exit,,"SanFrancisco, USA","Boku, the leading direct carrier billing mobile payments company, brings bank­‐grade payments technology and mobile users together, creating a trusted, accessible platform for consumers, merchants and operators alike. Based in San Francisco with offices in Europe, Latin America, and Asia, boku reaches more than 4 billion consumers worldwide, across 67 different countries with more than 250 operators. In 2014, boku acquired Mopay. In November 2017, Boku went public on London Stock Exchange’s Alternative Investment Market (AIM).","Boku, the leading direct carrier billing mobile payments company, brings bank­‐grade payments technology and mobile users together, creating a trusted, accessible platform for consumers, merchants and operators alike. Based in San Francisco with offices in Europe, Latin America, and Asia, boku reaches more than 4 billion consumers worldwide, across 67 different countries with more than 250 operators. In 2014, boku acquired Mopay. In November 2017, Boku went public on London Stock Exchange’s Alternative Investment Market (AIM).",http://www.boku.com/,https://www.hvcapital.com/companies
claimsforce.com,claimsforce,point_nine,ICP 2,10,3,high,api,Enterprise|Fintech,Pre-seed,,"Hamburg, Germany","claimsforce is a Hamburg-based insurtech providing a SaaS platform for end-to-end claims management. It builds modern claims software for P&C insurers and loss adjusters, offering modular tools to digitize and automate processes, improving cycle times and customer experience across DACH and the UK.","claimsforce is a Hamburg-based insurtech providing a SaaS platform for end-to-end claims management. It builds modern claims software for P&C insurers and loss adjusters, offering modular tools to digitize and automate processes, improving cycle times and customer experience across DACH and the UK.",https://www.claimsforce.com/,https://www.pointnine.com/companies
qonto.com,Qonto,hv_capital,ICP 1,8,15,high,api|docs|developers|auth|app|status,fintech,growth,,"Paris, France",Qonto is an online bank that provides financial tools for small and medium-sized businesses and freelancers.,Qonto is an online bank that provides financial tools for small and medium-sized businesses and freelancers.,https://qonto.com/en,https://www.hvcapital.com/companies
sumup.com,SUMUP,hv_capital,ICP 1,8,15,high,api|docs|developer|auth|dashboard|status,fintech,growth,,"Luxembourg, Luxembourg",SumUp is the leading mobile point-of-sale (mPOS) company in Europe. Our company vision is to become the first ever global card acceptance brand. Today hundreds of thousands of merchants accept card payments with SumUp in 31 countries.,SumUp is the leading mobile point-of-sale (mPOS) company in Europe. Our company vision is to become the first ever global card acceptance brand. Today hundreds of thousands of merchants accept card payments with SumUp in 31 countries.,https://www.sumup.com/,https://www.hvcapital.com/companies
candis.io,Candis,point_nine,ICP 1,8,9,high,api|developer|app|status,Enterprise|Fintech,Seed,,"Berlin, Germany","Founded in 2015, Candis offers a cloud solution for finance teams to manage invoices at scale: centralizing receipt, automating data extraction and duplicate detection, streamlining multi-step approvals, and syncing to accounting and payment tools.","Founded in 2015, Candis offers a cloud solution for finance teams to manage invoices at scale: centralizing receipt, automating data extraction and duplicate detection, streamlining multi-step approvals, and syncing to accounting and payment tools.",http://www.candis.io/,https://www.pointnine.com/companies
comet.rocks,Comet,hv_capital,ICP 1,8,7,high,docs|console|status,fintech,early,,"Berlin, Germany",paragraph,paragraph,https://www.comet.rocks,https://www.hvcapital.com/companies
payrails.com,Payrails,hv_capital,ICP 1,8,4,high,docs|status,fintech,seed,,"Berlin, Germany",Payrails enables high-growth companies to craft their payment experiences and financial services globally.,Payrails enables high-growth companies to craft their payment experiences and financial services globally.,https://www.payrails.com,https://www.hvcapital.com/companies
funanga.com,Funanga,hv_capital,ICP 1,8,3,high,docs,fintech,exit,,"Berlin, Germany","With cash to code, Funanga offers a mobile payment system, allowing individuals to pay for internet services fast, easy and anonymous. For this purpose, Funanga builds a network of points of sale, where customers can buy virtual prepaid cards via a smartphone app. The characteristic feature of cash to code is that customers can pay cash down.","With cash to code, Funanga offers a mobile payment system, allowing individuals to pay for internet services fast, easy and anonymous. For this purpose, Funanga builds a network of points of sale, where customers can buy virtual prepaid cards via a smartphone app. The characteristic feature of cash to code is that customers can pay cash down.",http://www.funanga.com/,https://www.hvcapital.com/companies
midas.app,Midas,hv_capital,ICP 1,8,3,high,docs,fintech,early,,"Berlin, Germany","Insitutional-grade Assets built for the Open Web. Midas offers investors exposure to investment-grade securities on-chain, while harnessing the full suite of DeFi applications via a permissionless ERC-20 token.","Insitutional-grade Assets built for the Open Web. Midas offers investors exposure to investment-grade securities on-chain, while harnessing the full suite of DeFi applications via a permissionless ERC-20 token.",https://midas.app/,https://www.hvcapital.com/companies
gigs.com,Gigs,speedinvest,ICP 2,7,18,high,api|docs|developer|developers|auth|dashboard|status,Growth,2021,,United States of America,Empowering businesses to effortlessly embed telecom capabilities into their platforms.,"Gigs, the operating system for mobile services, empowers tech companies to seamlessly embed connectivity into their offerings in weeks. ‍ By bundling phone plans and travel data with their core services, Gigs' customers can increase stickiness and unlock a new recurring revenue stream with digital mobile experiences that meaningfully create value for consumers. Gigs' end-to-end platform provides everything brands like Klarna, Nubank, and OnePay need to launch and operate their own multi-market mobile service: premium connectivity, a hosted checkout, billing, subscription management, analytics, and AI-powered customer service. ‍",http://gigs.com/,https://www.speedinvest.com/portfolio/
atlassian.com,Wikidocs,speedinvest,ICP 2,7,16,high,api|docs|developer|developers|auth|status,Exits,2012,,Austria,"Turning web pages into live, editable “docs” services in minutes.","Wikidocs (acquired by Atlassian) was a real-time collaboration framework that turns any web page into a live, editable ‘docs’ service in minutes with the ability to build content, create, edit, and share – all at once. The solution saved users the hours of wait and back and forth communication waiting to receive the latest version with changes. ‍ Wikidocs offered this service through an API and a few lines of Javascript to be added to client websites.",https://www.atlassian.com/,https://www.speedinvest.com/portfolio/
brevo.com,Metrilo,speedinvest,ICP 2,7,14,high,api|developers|auth|app|dashboard|status,Exits,2018,,Bulgaria,Tailored to the needs of e-commerce websites.,"Metrilo (acquired by Brevo in 2021) is a suite of analytics and marketing tools for eCommerce websites. It helps merchants track key performance indicators (KPIs), analyze trends, and make data-driven decisions to increase retention, conversion and sales performance. Metrilo’s CRM platform also allows webshops to send highly targeted email campaigns and to measure their success rates. ‍ The company's software is easy to install and integrates with all major e-commerce platforms such as Woocommerce, Shopify, or Magento. As of January 2018 the company has hit over $100MM USD in total sales generated with their email automation and segmentation tools alone.",https://www.brevo.com/,https://www.speedinvest.com/portfolio/
moonpay.com,MoonPay,speedinvest,ICP 2,7,14,high,api|docs|auth|app|dashboard|status,Growth,2025,,United States of America,The global infrastructure for seamless crypto payments.,"MoonPay is a financial technology platform enabling individuals and businesses to buy, sell, and manage digital assets through simple, compliant, and user-friendly on- and off-ramps. By integrating payments, identity verification, and regulatory infrastructure into a single experience, MoonPay powers access to the crypto economy for users and enterprises worldwide. In 2025, MoonPay joined our portfolio following its share-swap acquisition of Iron.",https://www.moonpay.com,https://www.speedinvest.com/portfolio/
avatao.com,avatao,speedinvest,ICP 2,7,12,high,docs|developer|auth|platform,AI & Infra,2018,,Hungary,Helping developers deliver high-quality products by immersing them in real-life scenarios of security best practices.,"Avatao is a hands-on secure coding learning platform used by developers, security champions, pentesters, security analysts, and DevOps teams around the world to improve their IT security knowledge, and to speed up secure product development. The Avatao platform offers more than 600 real-life tutorials and challenges in the most popular programming languages, covering the most crucial security topics, from secure DevOps via API security to cryptography. Whether you need to teach your developers the fundamentals in a security awareness training, provide them a continuous training based on career tracks or build a security champions program, Avatao is the right tool for you.",https://avatao.com/,https://www.speedinvest.com/portfolio/
bitpanda.com,Bitpanda,speedinvest,ICP 2,7,12,high,api|developer|developers|app|status,Growth,2020,,Austria,"Europe’s leading platform for investing in crypto, stocks, ETFs and precious metals.","Bitpanda is fully regulated and licensed investment platform, enabling both retail and institutional users to trade a wide variety of assets, including cryptocurrencies, fractionalized stocks, Exchange-Traded Funds (ETFs), and precious metals. ‍ Bitpanda Technology Solutions (BTS) offers a modular, white-label API infrastructure, allowing established banks and other FinTechs to rapidly integrate compliant digital asset trading and custody services into their own customer applications.",https://www.bitpanda.com,https://www.speedinvest.com/portfolio/
mews.com,Mews,speedinvest,ICP 2,7,12,high,api|docs|developers|app|status,AI & Infra,2025,,Netherlands,The hospitality management platform powering modern hotels.,"Mews is a property management system designed to streamline and automate hotel operations. By integrating reservations, front desk, payments, guest experience, and back-office workflows into a single platform, Mews enables hospitality operators to increase efficiency, unlock new revenue streams, and deliver a seamless guest journey. Trusted by thousands of properties worldwide, Mews is redefining how hospitality businesses operate. In 2025, Mews joined our portfolio following its acquisition of Flexkeeping.",https://www.mews.com/en,https://www.speedinvest.com/portfolio/
tide.co,Tide,speedinvest,ICP 2,7,12,high,api|docs|developers|app|status,Growth,2018,,United Kingdom,SME challenger bank redefining business banking.,"Tide is a leading UK-based fintech platform built specifically to simplify banking and financial administration for Small and Medium Enterprises (SMEs), freelancers, and sole traders. Operating entirely digitally, Tide provides its members with a dedicated business current account that is managed entirely through its proprietary mobile and web application. ‍ Beyond just standard transactions, Tide integrates core administrative features like invoicing, expense management, and receipt capture directly into the banking experience, turning the account into a comprehensive financial management hub for business owners. ‍",https://www.tide.co/,https://www.speedinvest.com/portfolio/
wayflyer.com,Wayflyer,speedinvest,ICP 2,7,12,high,api|docs|auth|app|status,Growth,2020,,Ireland,Revenue-based financing for e-commerce brands.,"The dedicated growth engine for ambitious e-commerce and Direct-to-Consumer (DTC) brands globally. Wayflyer pioneered revenue-based financing (RBF), a fast, flexible alternative to traditional loans or equity sales. Fund and optimzing growth, the platform provides proprietary analytics and benchmarking tools that give brands critical insights into cash flow and ad spend performance, ensuring every dollar is invested where it will generate the maximum return, turning working capital into a true competitive advantage. ‍",https://www.wayflyer.com/,https://www.speedinvest.com/portfolio/
autone.io,Autone,speedinvest,ICP 2,7,11,high,api|docs|auth|app,AI & Infra,2022,,Italy,An end-to-end operational decision platform for the luxury and broader consumer goods industry.,"Autone is an end-to-end operational decision platform for the luxury and broader consumer goods industry. ‍ With their user-friendly platform, they provide customers with decision recommendations of their inventory, demand, supply planning, pricing elasticity, and analytics operations in a slick and collaborative manner.",https://www.autone.io/,https://www.speedinvest.com/portfolio/
dragandbot.com,drag&bot,speedinvest,ICP 2,7,11,high,api|docs|auth|app,Climate Tech & Industrial Tech,2018,,Germany,Supporting production companies to cost-effectively automate with industrial robots.,"drag&bot (acquired by KEBA in 2022) is an intuitive, web-based software platform for easy setup, programming and operation of industrial robots. With its graphical interface no prior robotics skills are needed to step your company into the era of automation. Their solution can be deployed across all relevant, industrial robotic systems and offers a high degree of flexibility, making industrial robots economical even for small production batches.",https://www.dragandbot.com/,https://www.speedinvest.com/portfolio/
